{
  "request_id": "6e1328c2-3554-4c2d-8153-5639304a6b18",
  "operation": "evolution_pool_rollout",
  "target_commit": "e3a436ffce2624080beb9a71a61d60ca0ed65320",
  "branch": "build/vasa-foundation",
  "environment": "staging",
  "scope": "evolution-pool-only",
  "policy": "evolution-no-call-backup-v1",
  "authorization": "evolution-pool-2026-10-17",
  "reason": "Operator-approved pinned Evolution pool lifecycle fix with verified backups and a no-call maintenance gate",
  "created_at": "2026-10-17T05:37:10Z",
  "expires_at": "2026-10-17T17:37:10Z",
  "expected_markers": [
    "VASA_EVOLUTION_POOL_DEPLOYMENT_OK"
  ]
}
