{
  "request_id": "950fd133-6d12-4ff8-9d16-9be7c8a7bdf2",
  "operation": "evolution_check",
  "target_commit": "e40f04a2ea0f78ecfd8b8b93f6b6e34234104b62",
  "branch": "build/vasa-foundation",
  "environment": "staging",
  "scope": "evolution-readonly",
  "policy": "evolution-readonly-v1",
  "authorization": "routine-staging-v1",
  "reason": "Read-only post-rollback health and public-origin failure diagnosis; no container mutation",
  "created_at": "2026-10-17T05:51:18Z",
  "expires_at": "2026-10-17T17:51:18Z",
  "expected_markers": [
    "EVOLUTION_POOL_PREFLIGHT_OK"
  ]
}
