{
  "request_id": "a069d0e7-b238-4608-aab3-9faca99ccdde",
  "operation": "evolution_check",
  "target_commit": "4ec0f3f0ac87ae27108f9a0c8e8746cb66df6c6b",
  "branch": "build/vasa-foundation",
  "environment": "staging",
  "scope": "evolution-readonly",
  "policy": "evolution-readonly-v1",
  "authorization": "routine-staging-v1",
  "reason": "Demonstrate automatic read-only staging preflight through the existing Actions bridge",
  "created_at": "2026-10-17T05:33:06Z",
  "expires_at": "2026-10-17T17:33:06Z",
  "expected_markers": [
    "EVOLUTION_POOL_PREFLIGHT_OK"
  ]
}
