{
  "request_id": "1d64d376-3568-4510-8f51-38560fc402e9",
  "operation": "evolution_pool_rollout",
  "target_commit": "390aa0d4c784d9952bd93e3224d82cf9edfe02d9",
  "branch": "build/vasa-foundation",
  "environment": "staging",
  "scope": "evolution-pool-only",
  "policy": "evolution-no-call-backup-v1",
  "authorization": "evolution-pool-2026-10-17-renewed-health-1",
  "reason": "Operator Authorization B: one guarded reviewed Evolution PostgreSQL pool lifecycle rollout after successful identified-health run39013001527; require fresh no-call, verified backup restoration, rollback, pairing preservation and all health gates",
  "created_at": "2026-10-17T07:22:35Z",
  "expires_at": "2026-10-17T13:20:19Z",
  "expected_markers": [
    "VASA_EVOLUTION_POOL_DEPLOYMENT_OK"
  ]
}
